{
  "$ref": "#/definitions/specs",
  "definitions": {
    "specs": {
      "type": "object",
      "properties": {
        "attributeValue": {
          "type": "string"
        },
        "categorySlug": {
          "type": "string"
        },
        "naturalSlug": {
          "type": "string"
        },
        "seoTitle": {
          "type": "string"
        },
        "seoDescription": {
          "type": "string"
        },
        "seoContent": {
          "type": "string"
        },
        "$schema": {
          "type": "string"
        }
      },
      "required": [
        "attributeValue",
        "categorySlug",
        "naturalSlug",
        "seoTitle",
        "seoDescription"
      ],
      "additionalProperties": false
    }
  },
  "$schema": "http://json-schema.org/draft-07/schema#"
}