{
  "attributeValue": "RTX 4070 Graphics",
  "categorySlug": "laptops",
  "naturalSlug": "rtx-4070-laptops",
  "seoTitle": "RTX 4070 Laptops - High-End Gaming Notebooks",
  "seoDescription": "Discover laptops with NVIDIA RTX 4070 graphics for exceptional gaming and creative performance. Ray tracing, DLSS 3, and more.",
  "seoContent": "The NVIDIA GeForce RTX 4070 brings desktop-class performance to laptops. With dedicated ray tracing cores, Tensor cores for DLSS 3 AI upscaling, and Ada Lovelace architecture efficiency, RTX 4070 laptops deliver stunning visuals at high frame rates. Perfect for AAA gaming at QHD resolution, 3D rendering, video editing, and AI workloads."
}
