{
  "attributeValue": "32GB RAM",
  "categorySlug": "laptops",
  "naturalSlug": "32gb-laptops",
  "seoTitle": "32GB Laptops - High Memory Laptops for Power Users",
  "seoDescription": "Browse our selection of 32GB RAM laptops. Perfect for gaming, video editing, 3D rendering, and multitasking. Shop top brands now.",
  "seoContent": "32GB of RAM is the sweet spot for power users who demand more from their laptops. Whether you're a content creator working with large video files, a developer running multiple virtual machines, or a gamer who wants smooth performance with background applications, 32GB laptops deliver the memory headroom you need. Our selection includes gaming laptops, workstations, and premium ultrabooks from leading manufacturers."
}
