{
  "attributeValue": "16GB RAM",
  "categorySlug": "laptops",
  "naturalSlug": "16gb-laptops",
  "seoTitle": "16GB Laptops - Balanced Performance Laptops",
  "seoDescription": "Shop 16GB RAM laptops offering the perfect balance of performance and value. Ideal for work, gaming, and creative tasks.",
  "seoContent": "16GB RAM is the ideal amount for most users today. Whether you're a professional handling everyday business applications, a casual gamer, or a student managing multiple browser tabs and productivity apps, 16GB provides smooth, responsive performance without breaking the bank. Our 16GB laptops range from budget-friendly options to premium machines."
}
